[
  {
    "case_id": "SYN-13356886",
    "synthetic": true,
    "patient_demographics": {
      "age": 53,
      "gender": "Male",
      "blood_group": "B-"
    },
    "chief_complaint": "I don't know what's happening but my chest started hurting suddenly while sitting on the couch.",
    "symptoms": [
      "Chest Pain",
      "Chest Pain"
    ],
    "symptom_onset": "30 minutes ago",
    "symptom_duration": "Ongoing",
    "severity": "CRITICAL",
    "vital_signs": {
      "heart_rate": 126,
      "spo2": 85,
      "bp_systolic": 87,
      "bp_diastolic": 42,
      "temp_c": 37.1
    },
    "medical_history": [
      "Coronary Artery Disease",
      "High Cholesterol"
    ],
    "medications": [
      "Aspirin 75mg",
      "Atorvastatin 20mg"
    ],
    "emergency_red_flags": [
      "Crushing Chest Pain",
      "Radiation to Left Arm",
      "Sudden Onset"
    ],
    "conversation": [
      {
        "turn": 1,
        "speaker": "mira",
        "text": "Hello, I am MIRA, your AI nurse assistant. How can I help you today?"
      },
      {
        "turn": 2,
        "speaker": "patient",
        "text": "I don't know what's happening but my chest started hurting suddenly while sitting on the couch."
      },
      {
        "turn": 3,
        "speaker": "mira",
        "text": "I understand you have chest discomfort. Are you experiencing shortness of breath, sweating, or radiation to your left arm or jaw?"
      },
      {
        "turn": 4,
        "speaker": "patient",
        "text": "Yes, I am sweating and my arm feels heavy."
      }
    ],
    "structured_clinical_info": {
      "chestPain": true,
      "breathingDifficulty": false,
      "unconsciousness": false,
      "painSeverity": "severe",
      "painScore": 9,
      "suddenOnset": true,
      "radiationLeftArm": true
    },
    "expected_triage_category": "CRITICAL",
    "expected_escalation_action": "Dispatch Immediate ALS Emergency Ambulance & Alert Nearest Trauma Center",
    "generation_metadata": {
      "generator_version": "1.0.0",
      "category": "Chest Pain",
      "seed": 42,
      "created_at": "2026-08-27T14:33:59.546032"
    }
  },
  {
    "case_id": "SYN-13999315",
    "synthetic": true,
    "patient_demographics": {
      "age": 29,
      "gender": "Male",
      "blood_group": "B-"
    },
    "chief_complaint": "I'm struggling... to get... any air in...",
    "symptoms": [
      "Breathing Difficulty"
    ],
    "symptom_onset": "30 minutes ago",
    "symptom_duration": "Ongoing",
    "severity": "HIGH",
    "vital_signs": {
      "heart_rate": 124,
      "spo2": 90,
      "bp_systolic": 157,
      "bp_diastolic": 93,
      "temp_c": 38.1
    },
    "medical_history": [
      "No known past medical history"
    ],
    "medications": [],
    "emergency_red_flags": [
      "Severe Respiratory Distress",
      "Inability to speak full sentences"
    ],
    "conversation": [
      {
        "turn": 1,
        "speaker": "mira",
        "text": "Hello, I am MIRA, your AI nurse assistant. How can I help you today?"
      },
      {
        "turn": 2,
        "speaker": "patient",
        "text": "I'm struggling... to get... any air in..."
      },
      {
        "turn": 3,
        "speaker": "mira",
        "text": "I see you are having trouble breathing. Can you speak in full sentences, and do you have asthma or heart disease?"
      },
      {
        "turn": 4,
        "speaker": "patient",
        "text": "Hard to speak... gasping for air."
      }
    ],
    "structured_clinical_info": {
      "chestPain": false,
      "breathingDifficulty": true,
      "unconsciousness": false,
      "painSeverity": "severe",
      "painScore": 7,
      "suddenOnset": true,
      "radiationLeftArm": null
    },
    "expected_triage_category": "HIGH",
    "expected_escalation_action": "Dispatch BLS Emergency Ambulance & Reserve Urgent ER Bay",
    "generation_metadata": {
      "generator_version": "1.0.0",
      "category": "Breathing Difficulty",
      "seed": 42,
      "created_at": "2026-08-27T14:33:59.546086"
    }
  },
  {
    "case_id": "SYN-39587039",
    "synthetic": true,
    "patient_demographics": {
      "age": 75,
      "gender": "Other",
      "blood_group": "O+"
    },
    "chief_complaint": "Fell off a 12 foot ladder onto concrete, severe hip and neck pain.",
    "symptoms": [
      "Major Trauma"
    ],
    "symptom_onset": "2 days ago",
    "symptom_duration": "Ongoing",
    "severity": "MODERATE",
    "vital_signs": {
      "heart_rate": 90,
      "spo2": 96,
      "bp_systolic": 131,
      "bp_diastolic": 85,
      "temp_c": 37.2
    },
    "medical_history": [
      "Hypertension",
      "Type 2 Diabetes"
    ],
    "medications": [
      "Amlodipine 5mg",
      "Telmisartan 40mg",
      "Metformin 500mg"
    ],
    "emergency_red_flags": [
      "High Mechanism Trauma",
      "Full Thickness Burn"
    ],
    "conversation": [
      {
        "turn": 1,
        "speaker": "mira",
        "text": "Hello, I am MIRA, your AI nurse assistant. How can I help you today?"
      },
      {
        "turn": 2,
        "speaker": "patient",
        "text": "Fell off a 12 foot ladder onto concrete, severe hip and neck pain."
      },
      {
        "turn": 3,
        "speaker": "mira",
        "text": "Thank you. On a scale of 0 to 10, how severe is your pain or discomfort right now?"
      },
      {
        "turn": 4,
        "speaker": "patient",
        "text": "I'd rate it an 3 out of 10."
      }
    ],
    "structured_clinical_info": {
      "chestPain": false,
      "breathingDifficulty": false,
      "unconsciousness": false,
      "painSeverity": "moderate",
      "painScore": 4,
      "suddenOnset": false,
      "radiationLeftArm": false
    },
    "expected_triage_category": "MODERATE",
    "expected_escalation_action": "Recommend Urgent Clinic Visit within 2 Hours",
    "generation_metadata": {
      "generator_version": "1.0.0",
      "category": "Major Trauma",
      "seed": 42,
      "created_at": "2026-08-27T14:33:59.546117"
    }
  },
  {
    "case_id": "SYN-55176955",
    "synthetic": true,
    "patient_demographics": {
      "age": 31,
      "gender": "Male",
      "blood_group": "AB+"
    },
    "chief_complaint": "I cut my arm deep with a power tool and blood is pulsing out everywhere!",
    "symptoms": [
      "Severe Bleeding"
    ],
    "symptom_onset": "2 days ago",
    "symptom_duration": "Ongoing",
    "severity": "LOW",
    "vital_signs": {
      "heart_rate": 79,
      "spo2": 99,
      "bp_systolic": 119,
      "bp_diastolic": 74,
      "temp_c": 37.0
    },
    "medical_history": [
      "Asthma"
    ],
    "medications": [
      "Salbutamol Inhaler"
    ],
    "emergency_red_flags": [
      "Active Heavy Arterial Bleeding"
    ],
    "conversation": [
      {
        "turn": 1,
        "speaker": "mira",
        "text": "Hello, I am MIRA, your AI nurse assistant. How can I help you today?"
      },
      {
        "turn": 2,
        "speaker": "patient",
        "text": "I cut my arm deep with a power tool and blood is pulsing out everywhere!"
      },
      {
        "turn": 3,
        "speaker": "mira",
        "text": "Thank you. On a scale of 0 to 10, how severe is your pain or discomfort right now?"
      },
      {
        "turn": 4,
        "speaker": "patient",
        "text": "I'd rate it an 3 out of 10."
      }
    ],
    "structured_clinical_info": {
      "chestPain": false,
      "breathingDifficulty": false,
      "unconsciousness": false,
      "painSeverity": "mild",
      "painScore": 2,
      "suddenOnset": false,
      "radiationLeftArm": true
    },
    "expected_triage_category": "LOW",
    "expected_escalation_action": "Routine Tele-consultation & Home Monitoring Advice",
    "generation_metadata": {
      "generator_version": "1.0.0",
      "category": "Severe Bleeding",
      "seed": 42,
      "created_at": "2026-08-27T14:33:59.546140"
    }
  },
  {
    "case_id": "SYN-81971316",
    "synthetic": true,
    "patient_demographics": {
      "age": 33,
      "gender": "Female",
      "blood_group": "A-"
    },
    "chief_complaint": "Fell off a 12 foot ladder onto concrete, severe hip and neck pain.",
    "symptoms": [
      "Burns"
    ],
    "symptom_onset": "30 minutes ago",
    "symptom_duration": "Ongoing",
    "severity": "CRITICAL",
    "vital_signs": {
      "heart_rate": 124,
      "spo2": 89,
      "bp_systolic": 99,
      "bp_diastolic": 61,
      "temp_c": 38.0
    },
    "medical_history": [
      "No known past medical history"
    ],
    "medications": [],
    "emergency_red_flags": [
      "High Mechanism Trauma",
      "Full Thickness Burn"
    ],
    "conversation": [
      {
        "turn": 1,
        "speaker": "mira",
        "text": "Hello, I am MIRA, your AI nurse assistant. How can I help you today?"
      },
      {
        "turn": 2,
        "speaker": "patient",
        "text": "Fell off a 12 foot ladder onto concrete, severe hip and neck pain."
      },
      {
        "turn": 3,
        "speaker": "mira",
        "text": "Thank you. On a scale of 0 to 10, how severe is your pain or discomfort right now?"
      },
      {
        "turn": 4,
        "speaker": "patient",
        "text": "I'd rate it an 8 out of 10."
      }
    ],
    "structured_clinical_info": {
      "chestPain": false,
      "breathingDifficulty": false,
      "unconsciousness": false,
      "painSeverity": "severe",
      "painScore": 9,
      "suddenOnset": true,
      "radiationLeftArm": null
    },
    "expected_triage_category": "CRITICAL",
    "expected_escalation_action": "Dispatch Immediate ALS Emergency Ambulance & Alert Nearest Trauma Center",
    "generation_metadata": {
      "generator_version": "1.0.0",
      "category": "Burns",
      "seed": 42,
      "created_at": "2026-08-27T14:33:59.546161"
    }
  },
  {
    "case_id": "SYN-16150444",
    "synthetic": true,
    "patient_demographics": {
      "age": 47,
      "gender": "Female",
      "blood_group": "A-"
    },